{
  "packet_id": "FED21-DEMO-001",
  "schema_version": "2.1",
  "created_at": "2026-10-23T16:00:00Z",
  "expires_at": "2026-10-24T16:00:00Z",
  "source_node": "CENTRO-CHATGPT",
  "target_node": "GEMINI-CANDIDATE",
  "project_id": "RENOVA-AI-SAFETY-GOVERNANCE",
  "data_classification": "PUBLIC",
  "mission": "Review epistemic provenance protocol and list falsification criteria",
  "requested_operation": "REVIEW",
  "source_refs": [
    "https://github.com/reyfilosofo/renova-agent"
  ],
  "state": "PREPARED",
  "provider_receipt_id": null,
  "readback_verified": false
}
